[I 2025-05-10 00:11:33,280] Trial 4 finished with value: 0.998102223429794 and parameters: {'n_estimators': 100, 'learning_rate': 0.22413234378101138, 'max_depth': 15, 'subsample': 0.9041986740582306, 'colsample_bytree': 0.6523068845866853, 'gamma': 7.073702489270826e-08, 'lambda': 0.0029775853025212607, 'alpha': 3.320625892007924e-05}. Best is trial 3 with value: 0.9983972376500404. 
Лучшие гиперпараметры: {'n_estimators': 500, 'learning_rate': 0.08810003129071789, 'max_depth': 5, 'subsample': 0.757117219206805
Лучшие гиперпараметры: {'n_estimators': 500, 'learning_rate': 0.08810003129071789, 'max_depth': 5, 'subsample': 0.7571172192068059, 'colsample_bytree': 0.7962072844310213, 'gamma': 2.535541638745669e-08, 'lambda': 0.0007250347382396634, 'alpha': 2.3130924416
Лучшие гиперпараметры: {'n_estimators': 500, 'learning_rate': 0.08810003129071789, 'max_depth': 5, 'subsample': 0.7571172192068059, 'colsample_bytree': 0.7962072844310213, 'gamma': 2.535541638745669e-08, 'lambda': 0.0007250347382396634, 'alpha': 2.3130924416844053e-07}
Лучшее значение метрики (f1_macro): 0.9983972376500404
Оптимизация для xgboost завершена. Лучший F1 (macro): 0.9984

Оптимизация для lightgbm...
[I 2025-05-10 00:11:33,283] A new study created in memory with name: no-name-032df4c4-a8dc-45a9-ba95-0beaca4aa043
[I 2025-05-10 00:11:50,179] Trial 0 finished with value: 0.9985268852626166 and parameters: {'n_estimators': 400, 'learning_rate'
[I 2025-05-10 00:11:50,179] Trial 0 finished with value: 0.9985268852626166 and parameters: {'n_estimators': 400, 'learning_rate': 0.22648248189516848, 'max_depth': 12, 'num_leaves': 398, 'subsample': 0.5780093202212182, 'colsample_bytree': 0.577997260168101
[I 2025-05-10 00:11:50,179] Trial 0 finished with value: 0.9985268852626166 and parameters: {'n_estimators': 400, 'learning_rate': 0.22648248189516848, 'max_depth': 12, 'num_leaves': 398, 'subsample': 0.5780093202212182, 'colsample_bytree': 0.5779972601681014, 'reg_alpha': 3.3323645788192616e-08, 'reg_lambda': 0.6245760287469893}. Best is trial 0 with value: 0.9985268852626166.       
[I 2025-05-10 00:12:02,770] Trial 1 finished with value: 0.9985781864094118 and parameters: {'n_estimators': 650, 'learning_rate'
[I 2025-05-10 00:12:02,770] Trial 1 finished with value: 0.9985781864094118 and parameters: {'n_estimators': 650, 'learning_rate': 0.05675206026988748, 'max_depth': 3, 'num_leaves': 2579, 'subsample': 0.9162213204002109, 'colsample_bytree': 0.606169555339138
[I 2025-05-10 00:12:02,770] Trial 1 finished with value: 0.9985781864094118 and parameters: {'n_estimators': 650, 'learning_rate': 0.05675206026988748, 'max_depth': 3, 'num_leaves': 2579, 'subsample': 0.9162213204002109, 'colsample_bytree': 0.6061695553391381, 'reg_alpha': 4.329370014459266e-07, 'reg_lambda': 4.4734294104626844e-07}. Best is trial 1 with value: 0.9985781864094118.    
[I 2025-05-10 00:12:16,606] Trial 2 finished with value: 0.998520771242028 and parameters: {'n_estimators': 350, 'learning_rate':
[I 2025-05-10 00:12:16,606] Trial 2 finished with value: 0.998520771242028 and parameters: {'n_estimators': 350, 'learning_rate': 0.0199473547030745, 'max_depth': 8, 'num_leaves': 85, 'subsample': 0.8059264473611898, 'colsample_bytree': 0.569746930326021, 'r
[I 2025-05-10 00:12:16,606] Trial 2 finished with value: 0.998520771242028 and parameters: {'n_estimators': 350, 'learning_rate': 0.0199473547030745, 'max_depth': 8, 'num_leaves': 85, 'subsample': 0.8059264473611898, 'colsample_bytree': 0.569746930326021, 'reg_alpha': 4.258943089524393e-06, 'reg_lambda': 1.9826980964985924e-05}. Best is trial 1 with value: 0.9985781864094118.
[I 2025-05-10 00:12:30,431] Trial 3 finished with value: 0.9987751387975194 and parameters: {'n_estimators': 500, 'learning_rate'
[I 2025-05-10 00:12:30,431] Trial 3 finished with value: 0.9987751387975194 and parameters: {'n_estimators': 500, 'learning_rate': 0.08810003129071789, 'max_depth': 5, 'num_leaves': 260, 'subsample': 0.7962072844310213, 'colsample_bytree': 0.5232252063599989
[I 2025-05-10 00:12:30,431] Trial 3 finished with value: 0.9987751387975194 and parameters: {'n_estimators': 500, 'learning_rate': 0.08810003129071789, 'max_depth': 5, 'num_leaves': 260, 'subsample': 0.7962072844310213, 'colsample_bytree': 0.5232252063599989, 'reg_alpha': 0.0029369981104377003, 'reg_lambda': 3.425445902633376e-07}. Best is trial 3 with value: 0.9987751387975194.      
[I 2025-05-10 00:12:36,820] Trial 4 finished with value: 0.9985269802676062 and parameters: {'n_estimators': 100, 'learning_rate'
[I 2025-05-10 00:12:36,820] Trial 4 finished with value: 0.9985269802676062 and parameters: {'n_estimators': 100, 'learning_rate': 0.22413234378101138, 'max_depth': 15, 'num_leaves': 1143, 'subsample': 0.6523068845866853, 'colsample_bytree': 0.54883605700319
[I 2025-05-10 00:12:36,820] Trial 4 finished with value: 0.9985269802676062 and parameters: {'n_estimators': 100, 'learning_rate': 0.22413234378101138, 'max_depth': 15, 'num_leaves': 1143, 'subsample': 0.6523068845866853, 'colsample_bytree': 0.5488360570031919, 'reg_alpha': 0.014391207615728067, 'reg_lambda': 9.148975058772307e-05}. Best is trial 3 with value: 0.9987751387975194.     
Лучшие гиперпараметры: {'n_estimators': 500, 'learning_rate': 0.08810003129071789, 'max_depth': 5, 'num_leaves': 260, 'subsample'
Лучшие гиперпараметры: {'n_estimators': 500, 'learning_rate': 0.08810003129071789, 'max_depth': 5, 'num_leaves': 260, 'subsample': 0.7962072844310213, 'colsample_bytree': 0.5232252063599989, 'reg_alpha': 0.0029369981104377003, 'reg_lambda': 3.425445902633376
Лучшие гиперпараметры: {'n_estimators': 500, 'learning_rate': 0.08810003129071789, 'max_depth': 5, 'num_leaves': 260, 'subsample': 0.7962072844310213, 'colsample_bytree': 0.5232252063599989, 'reg_alpha': 0.0029369981104377003, 'reg_lambda': 3.425445902633376e-07}
Лучшее значение метрики (f1_macro): 0.9987751387975194
Оптимизация для lightgbm завершена. Лучший F1 (macro): 0.9988
--- Оптимизация гиперпараметров завершена ---
Добавление моделей в тренер...
Обучение моделей...
Обучение модели: logistic_regression
Обучение модели: random_forest
Обучение модели: gradient_boosting
Обучение модели: xgboost
Обучение модели: lightgbm
Обучение модели: svm
Оценка моделей...
Оценка модели: logistic_regression
Оценка модели: random_forest
Оценка модели: gradient_boosting
Оценка модели: xgboost
Оценка модели: lightgbm
Оценка модели: svm
Сохранение обученных моделей и метрик в ../output\models\trained_models_bundle.pkl...
Модели и метрики сохранены.
Создание сравнительных визуализаций...
Визуализация важности признаков...
График важности признаков для random_forest сохранен в ../output\results\plots\feature_importance_random_forest_20250510_002021.p
График важности признаков для random_forest сохранен в ../output\results\plots\feature_importance_random_forest_20250510_002021.png
График важности признаков для xgboost сохранен в ../output\results\plots\feature_importance_xgboost_20250510_002021.png
График важности признаков для lightgbm сохранен в ../output\results\plots\feature_importance_lightgbm_20250510_002023.png

Лучшая модель по F1-macro: lightgbm
Метрики лучшей модели:
  - accuracy: 0.9992
  - precision_macro: 0.9991
  - recall_macro: 0.9991
  - f1_macro: 0.9991
  - classification_report: (dict with keys: 0, 1, 2, 3, accuracy, macro avg, weighted avg)
  - confusion_matrix: (list of length 4)
  - y_pred: (list of length 18297)
  - y_proba: (list of length 18297)
Лучшая модель сохранена в ../output\models\best_model.pkl

Выполнение завершено в 2025-05-10 00:20:23
Общее время выполнения: 0:50:36.374120

Результаты сохранены в директории:
  - ../output